Rayyan Key,Authors,DOI,Title,Abstract,Date,User1,Decision,Labels,Notes
rayyan-229958724,"Filous, A and Friedlander, AM and Griffin, L and Lennox, RJ and Danylchuk, AJ and Mereb, G and Golbuu, Y",10.1016/j.fishres.2020.105688     WE  - Science Citation Index Expanded (SCI-EXPANDED)     WE  - Social Science Citation Index (SSCI),Movements of juvenile yellowfin tuna (Thunnus albacares) within the coastal FAD network adjacent to the Palau National Marine Sanctuary: Implications for local fisheries development,"Pacific Island nations and territories must build their capacity to harvest pelagic fishes to ensure domestic food security into the future. The Republic of Palau recently created the Palau National Marine Sanctuary, a Marine Managed Area that was intended to conserve marine resources and enhance local pelagic fisheries. However, the capacity of the nation's domestic fishery to exploit pelagic species must be built to meet these objectives and, to this aim, the development of a coastal network of Fish Attracting Devices (FADs) has been proposed. To inform the development of the nation's FAD program, we used acoustic telemetry to study the movements of yellowfin tuna (Thunnus albacares) within Palau's existing FAD network. Subadult yellowfin tuna (50 - 79 cm FL) remained within the FAD network for up to 175 days and young-of-the-year yellowfin tuna spent significantly more time in association with FADs in comparison to year-1 fish. A network analysis suggests that the Ngardmau and Peleliu FADs were the most important components of the current FAD network, and a mixed effects Poisson generalized linear model indicated that the residency of yellowfin tuna to these FADs was significantly related to mooring depth and distance from the reef. These results provide a description of yellowfin tuna movements within Palau's FAD network and recommendations to improve the nation's FAD program that are also applicable to other Pacific Island nations and territories that desire to improve domestic access to pelagic fish stocks.",2020-10-01,Bruna,Excluded,"MPA,Non-reef species,__EXR__Non-reef species",
rayyan-229958725,"Rhodes, KL and McIlwain, J and Joseph, E and Nemeth, RS",10.1007/s00338-012-0875-2     WE  - Science Citation Index Expanded (SCI-EXPANDED),"Reproductive movement, residency and fisheries vulnerability of brown-marbled grouper, Epinephelus fuscoguttatus (ForsskAyenl, 1775)","The brown-marbled grouper, Epinephelus fuscoguttatus, is a long-lived, late-maturing protogynous species listed as Near Threatened by the IUCN. In Pohnpei, Micronesia, reproductively active brown-marbled grouper were tagged with acoustic and spaghetti-type tags at a multi-species fish spawning aggregation (FSA) site to establish patterns of movement, residency and seasonality. Telemetry confirmed the use of common reproductive migratory corridors and significant sex-specific variations in residency at the FSA. Combined underwater visual census and telemetry data verified a 3-month peak aggregation period, with aggregations forming and persisting over ca. 12 days prior to full moon between January and May. FSA formation coincided with seasonally low and relatively stable seawater temperatures. Some males frequented the FSA site during each aggregation month over two consecutive years. Conversely, most females were present at the FSA during only a single aggregation period, with the month of visitation consistent among years. Nearly two-thirds of tagged fish were relocated or recaptured within 11 km of the aggregation site, with a maximum detected distance of 26 km and a minimum estimated catchment area of 100-175 km(2). Findings highlight the need for a combined approach to management that prohibits the capture and sale of reproductive adults and protects both spawning sites and common reproductive migratory corridors during aggregation periods.",2012-06-01,Bruna,Included,"Spawning,Mixed techniques",
rayyan-229958726,"Reynolds, BF and Powers, SP and Bishop, MA",10.1371/journal.pone.0012130     WE  - Science Citation Index Expanded (SCI-EXPANDED),Application of Acoustic Telemetry to Assess Residency and Movements of Rockfish and Lingcod at Created and Natural Habitats in Prince William Sound,"Loss and/or degradation of nearshore habitats have led to increased efforts to restore or enhance many of these habitats, particularly those that are deemed essential for marine fishes. Copper rockfish (Sebastes caurinus) and lingcod (Ophiodon enlongatus) are dominant members of the typical reef fish community that inhabit rocky and high-relief substrates along the Pacific Northwest. We used acoustic telemetry to document their residency and movements in the nearshore waters of Prince William Sound, Alaska in order to assess use of created reef habitat in an individual-based manner. A total of 57 fish were surgically implanted with acoustic transmitters. Forty-five fish were captured and monitored in three habitats: artificial reef, low-relief natural reef, and patchy high-relief natural reef. Within each habitat, both rockfish and lingcod exhibited long periods of residency with limited movements. Twelve rockfish were captured at the natural reefs and displaced a distance of 4.0 km to the artificial reef. Five of the 12 rockfish returned within 10 d of their release to their initial capture site. Another five of the 12 displaced fish established residency at the artificial reef through the duration of our study. Our results suggest the potential for artificial reefs to provide rockfish habitat in the event of disturbances to natural habitat.",2010-08-13,Bruna,Included,,
rayyan-229958740,"Tuohy, E and Schärer-Umpierre, M and Penrod, L and Appeldoorn, R",10.1002/aqc.3994,Spatial and temporal dynamics of a Nassau grouper fish spawning aggregation located on an isolated seamount in Puerto Rico,"The Nassau grouper, Epinephelus striatus, is a slow-growing, late-maturing, long-lived reef fish widely distributed throughout the south-western North Atlantic. Known for forming large spawning aggregations, numbering tens of thousands, they are now listed as Critically Endangered by the International Union for Conservation of Nature (IUCN). Recently, the only Nassau grouper spawning aggregation in Puerto Rico was documented at Bajo de Sico, a seamount and seasonally closed marine protected area.Studies elsewhere on the spatio-temporal dynamics of Nassau grouper aggregations have documented how, and how far, fish move from home sites to the spawning site, and have shown the tight link between aggregation formation and the lunar cycle. However, these studies have not evaluated the potential impacts of the reduced spatial extent represented by a seamount, nor have they addressed the impacts of local seasonal protection relative to the size of the closed area and the timing of aggregation formation.Acoustic telemetry was used to quantify the spatio-temporal dynamics of Nassau grouper spawning aggregation formation at Bajo de Sico. Twenty-six individuals were tagged and tracked over three consecutive spawning seasons.Nassau grouper formed three or four aggregations per season, corresponding to the lunar cycles from January to April. Individuals displayed high visitation rates to the aggregation site: 98% visited at least two peaks per season; 80% visited multiple seasons. The timing of arrival, departure, and residency at the site were significantly different among individuals and lunar months, indicating significant variability in aggregation formation. Nassau grouper occupied a relatively small staging area (2.7 km(2)) and courtship arena (0.67 km(2)) compared with aggregations occurring on continental/insular platforms or large atolls; movements off the seamount may occur but were not detected. Results indicate the current seasonal closure inadequately protects the spawning population on Bajo de Sico and should be extended to the end of June.",2023-10-01,Bruna,Included,"Spawning,Full text checked",
rayyan-231236858,"Mireles, C and Martin, CJB and Lowe, CG",10.5343/bms.2018.0009     WE  - Science Citation Index Expanded (SCI-EXPANDED),"Site fidelity, vertical movement, and habitat use of nearshore reef fishes on offshore petroleum platforms in southern California","Off California, economically important nearshore reef fishes inhabit the shallow (<20 m) regions of offshore petroleum platforms on the San Pedro Shelf (SPS). It is essential to understand the degrees to which platforms support fish over time to indicate whether biological requirements (e.g., shelter, diet, reproduction) are being met. To determine the ecological importance of platforms as fish habitat, the site fidelity and depth/habitat use of adult cabezon, Scorpaenichthys marmoratus (Ayres, 1854), grass rockfish, Sebastes rastrelliger (Jordan and Gilbert, 1880), kelp rockfish, Sebastes atrovirens (Jordan and Gilbert, 1880), and California sheephead, Semicossyphus pulcher (Ayres, 1854) were investigated at platforms Edith (50 m bottom depth) and Eureka (212 m). A total of 63 fish were acoustically tagged and monitored for up to 578 d. Sixty-three percent of individuals were still present at platforms at the end of the study (long-term site fidelity), with 55 individuals detected a mean of 66.9% (SD 36.0%) of their total days at liberty (daily site fidelity). All species displayed a shift in seasonal depth use. The shallowest horizontal level, consisting of various horizontal beams at platform Edith (15 m depth) and Eureka (17 m), was the most utilized habitat by grass rockfish, kelp rockfish, and California sheephead. Cabezon at platform Eureka utilized depths (21-31 m) unassociated with horizontal levels, while at platform Edith they primarily utilized the second horizontal level (30 m). Decommissioning options that remove the shallowest 26 m of structure would eliminate the habitat most utilized by three of the four study species that dominate the nearshore reef fish communities at SPS platforms.",2019-10-01,Bruna,Included,,
rayyan-231236864,"Casselberry, GA and Danylchuk, AJ and Finn, JT and DeAngelis, BM and Jordaan, A and Pollock, CG and Lundgren, I and Hillis-Starr, Z and Skomal, GB",10.3354/meps13158     WE  - Science Citation Index Expanded (SCI-EXPANDED),Network analysis reveals multispecies spatial associations in the shark community of a Caribbean marine protected area,"Many shark species exhibit complex spatial ecology throughout their life histories, posing a challenge for conservation and management. Although most marine protected areas (MPAs) were originally established to protect less mobile organisms, protection of shark species from fishing and other impacts is possible if individuals exhibit high residency and site fidelity within the MPA boundaries. For this study, we used a fixed acoustic telemetry array to study the residency, habitat use, and interspecific space use among 4 shark species in Buck Island Reef National Monument (BIRNM), an MPA in St. Croix, US Virgin Islands. From June 2013 to May 2017, 11 nurse sharks Ginglymostoma cirratum, 6 lemon sharks Negaprion brevirostris, 13 Caribbean reef sharks Carcharhinus perezi, and 6 tiger sharks Galeocerdo cuvier were monitored in the array. Overall, residency was high for all species, with a mean residency index of 0.52 or higher for each species. Network analysis revealed complex inter- and intraspecific spatial associations among individuals. Community detection algorithms showed that G. cirratum and N. brevirostris frequently used the same areas in BIRNM, selecting for shallow sand and seagrass habitats near linear reefs, while G. cuvier and C. perezi had more individualized space use. C. perezi also exhibited ontogenetic shifts, developing individual territories and using deeper water with increasing body size. This work emphasizes the importance of MPA size, placement, and habitat composition when aiming to protect highly mobile species with potentially large home ranges and shifting space use throughout their life histories.",2020-01-09,Bruna,Excluded,"MPA,Elasmo,__EXR__Elasmo",
rayyan-231236866,"Currey, LM and Heupel, MR and Simpfendorfer, CA and Williams, AJ",10.1007/s00227-014-2497-4     WE  - Science Citation Index Expanded (SCI-EXPANDED),Sedentary or mobile? Variability in space and depth use of an exploited coral reef fish,"Movement of fishes defines the distribution and abundance of populations and occurs on a range of spatial and temporal scales. To successfully parameterise assessments and design management strategies for exploited fish populations, knowledge and consideration of their movement patterns are essential. Since the efficacy of management approaches vary depending on the sedentary or mobile nature of the target species, presence, space use and depth utilisation were examined to understand the movement patterns of redthroat emperor Lethrinus miniatus. Sixty individuals were monitored for up to 12 months in an acoustic array comprising three coral reefs, and variation in space use and movement patterns was observed among 26 individuals. Half of the individuals were recorded only in proximity of one receiver along the reef edge, while the other half were detected at multiple receivers and used horizontal areas of approximately 4 km(2). Periods of non-detection and lower detection frequency at night (chi (1) (2) = 342.157, P < 0.001) indicated individuals may move away from the monitored reef edge to the adjacent sandy habitat, but most movements outside the array remain unknown. Long-distance movement was recorded for one individual, recaptured similar to 160 km from the release location. Generally, no trends in depth use were apparent, L. miniatus inhabited a variety of depths, which were not related to individual size or time of day, yet some effect of month was evident. Variation in movement among adult L. miniatus indicates that while some individuals undergo broader-scale movement, spatial closures that cover individual reefs (> 4 km(2)) could provide protection from fishing for the proportion of the population that displayed high site fidelity and moderate-sized activity spaces (over a period of up to 12 months).",2014-09-01,Bruna,Included,,
rayyan-231236876,"Kohler, J and Gore, M and Ormond, R and Johnson, B and Austin, T",10.1371/journal.pone.0293884     WE  - Science Citation Index Expanded (SCI-EXPANDED),Individual residency behaviours and seasonal long-distance movements in acoustically tagged Caribbean reef sharks in the Cayman Islands,"Understanding how reef-associated sharks use coastal waters through their ontogeny is important for their effective conservation and management. This study used the horizontal movements of acoustically tagged Caribbean reef sharks (Carcharhinus perezi) to examine their use of coastal space around the Cayman Islands between 2009 and 2019. A total of 39 (59.1%) tagged sharks (male = 22, female = 17, immature = 18, mature = 21) were detected on the islands wide network of acoustic receivers. The detection data were used to calculate values of Residency Index (RI), Site-Fidelity Index (SFI) and minimum linear displacement (MLD), as well as for network analysis of individual shark movements to test for differences between demographics, seasons, and diel periods. Sharks were detected for up to 1,598 days post-tagging and some individuals showed resident behaviour but the majority of tagged individuals appear to have been one-off or only occasional transient visitors to the area. Generally, individuals showed strong site-fidelity to different areas displaying linear home ranges of < 20 km. The evidence indicates that there was no pattern of diel behaviour. Tagged sharks generally showed increased movements within and between islands during the summer (April-September), which may be related to breeding activity. Some individuals even made occasional excursions across 110 km of open water > 2,000 m deep between Grand Cayman and Little Cayman. One mature female shark showed a displacement of 148.21 km, the greatest distance reported for this species. The data shows that the distances over which some sharks moved, greatly exceeded the extent of any one of the islands' marine protected areas indicating that this species may be more mobile and dispersive than previously thought. This study provides support for the blanket protection to all sharks throughout Cayman waters, which was incorporated within the National Conservation Act in 2015.",2023-11-27,Bruna,Excluded,"Elasmo,__EXR__Elasmo",
rayyan-231236893,"Bass, NC and Day, J and Guttridge, TL and Knott, NA and Brown, C",10.1111/jfb.14898,Preliminary observations on the movement ecology of a crested horn shark (Heterodontus galeatus),"The residency and movements of a single acoustically tagged female crested horn shark (Heterodontus galeatus) were monitored in Jervis Bay, Australia. The individual was intermittently detected by receivers throughout the 8-year study period and showed preference for particular rocky reefs in terms of its residency indices and duration of residency events. This individual exhibited lower residency and dissimilar movement patterns to that of the well-studied and sympatric Port Jackson shark (Heterodontus portusjacksoni), highlighting the need for research into the basic life history and movement ecology of H. galeatus.",2022-02-01,Bruna,Excluded,"Elasmo,__EXR__Elasmo",
rayyan-231236894,"Bond, ME and Babcock, EA and Pikitch, EK and Abercrombie, DL and Lamb, NF and Chapman, DD",10.1371/journal.pone.0032983     WE  - Science Citation Index Expanded (SCI-EXPANDED),Reef Sharks Exhibit Site-Fidelity and Higher Relative Abundance in Marine Reserves on the Mesoamerican Barrier Reef,"Carcharhinid sharks can make up a large fraction of the top predators inhabiting tropical marine ecosystems and have declined in many regions due to intense fishing pressure. There is some support for the hypothesis that carcharhinid species that complete their life-cycle within coral reef ecosystems, hereafter referred to as ""reef sharks'', are more abundant inside no-take marine reserves due to a reduction in fishing pressure (i.e., they benefit from marine reserves). Key predictions of this hypothesis are that (a) individual reef sharks exhibit high site-fidelity to these protected areas and (b) their relative abundance will generally be higher in these areas compared to fished reefs. To test this hypothesis for the first time in Caribbean coral reef ecosystems we combined acoustic monitoring and baited remote underwater video (BRUV) surveys to measure reef shark site-fidelity and relative abundance, respectively. We focused on the Caribbean reef shark (Carcharhinus perezi), the most common reef shark in the Western Atlantic, at Glover's Reef Marine Reserve (GRMR), Belize. Acoustically tagged sharks (N = 34) were detected throughout the year at this location and exhibited strong site-fidelity. Shark presence or absence on 200 BRUVs deployed at GRMR and three other sites (another reserve site and two fished reefs) showed that the factor ""marine reserve'' had a significant positive effect on reef shark presence. We rejected environmental factors or site-environment interactions as predominant drivers of this pattern. These results are consistent with the hypothesis that marine reserves can benefit reef shark populations and we suggest new hypotheses to determine the underlying mechanism(s) involved: reduced fishing mortality or enhanced prey availability.",2012-03-08,Bruna,Excluded,"Elasmo,__EXR__Elasmo",
rayyan-231236907,"Fontes, J and Afonso, P",10.1007/s00227-016-3045-1     WE  - Science Citation Index Expanded (SCI-EXPANDED),Long-term residency and movements of yellowmouth barracuda (Sphyraena viridensis) at a shallow seamount,"The yellowmouth barracuda Sphyraena viridensis, a highly mobile predator, is considered a migratory seasonal visitor to the Azores Islands by local fishers. This perception is challenged here through a combined analysis of multi-annual commercial landings, underwater visual census and telemetry data from acoustically tagged fish to investigate the long-term movement patterns and residency (up to 4 years) in a seamount marine reserve. Although the landing patterns suggested a strong seasonal variation in abundance, the visual census and the telemetry experiment results were consistent with year-round residency in the Azores. Barracudas occurred consistently in underwater census throughout the year, and most tagged fish were almost continuously detected at the seamounts for up to four consecutive years. Detection probability did, however, decrease over time and showed seasonal variability as tagged fish were less mobile with longer absences during summer and fall. Given the intrinsic vulnerability of fish aggregations to exploitation, our results highlight the need to protect shallow seamount habitats and preserve sexually mature fish aggregations and their reproductive potential, contributing to the sustainable management and conservation of these vulnerable ecosystems.",2017-01-01,Bruna,Excluded,"MPA,Other habitats,Mixed techniques,__EXR__Other habitats",
rayyan-231236915,"Drew, M and Rogers, P and Lloyd, M and Huveneers, C",10.1007/s00227-019-3500-x     WE  - Science Citation Index Expanded (SCI-EXPANDED),Seasonal occurrence and site fidelity of juvenile bronze whalers (Carcharhinus brachyurus) in a temperate inverse estuary,"Assessing the movements and habitat use of wide-ranging predators is critical for understanding their role within an ecosystem and vulnerability to anthropogenic threats. The bronze whaler (Carcharhinus brachyurus) is a large-bodied, slow-growing shark species that is widely distributed throughout temperate Australian waters. Currently, habitat use, spatio-temporal presence and fine-scale movement information is unknown for Southern Australian waters. This study investigated the spatio-temporal patterns of occurrence, habitat use, and residency of bronze whalers in Gulf St. Vincent, South Australia. Forty-seven predominately small juvenile bronze whalers (83% of tagged sharks<150cm TL) were tagged with acoustic transmitters from 2009 to 2014 and monitored for periods of up to 55months (range 516-1634days; mean +/- standard error 825 +/- 47). The seasonal presence of bronze whalers peaked in spring-early autumn (September-April). Site fidelity was high, with 77% of tagged sharks detected over multiple years and 36% detected over 3years. Low estimates of mean residency index (R-i=0.05 +/- 0.01) indicated that time spent within the array was limited. Shark occurrence was driven by a combination of factors, which included water temperature, season, moon illumination, and wind speed. Manly-Chesson's Electivity Index showed bronze whalers exhibited the highest affinity to seagrass (Posidonia spp.), suggesting that this habitat plays an important role in the early life history stages. The slow growth and low productivity of bronze whalers combined with its predictable nearshore occurrence result in this species having an increased susceptibility to anthropogenic threats, which highlights the need for continued monitoring and vulnerability assessments.",2019-05-01,Bruna,Excluded,"Elasmo,__EXR__Elasmo",
rayyan-231236918,"Graham, F and Rynne, P and Estevanez, M and Luo, JG and Ault, JS and Hammerschlag, N",10.1111/ddi.12425     WE  - Science Citation Index Expanded (SCI-EXPANDED),Use of marine protected areas and exclusive economic zones in the subtropical western North Atlantic Ocean by large highly mobile sharks,"Study aim and locationMany populations of highly mobile marine fishes, including large sharks, are experiencing declines. The benefits of spatial management zones, such as marine protected areas (MPAs), for such animals are unclear. To help fill this knowledge gap, we examined core habitat use areas (CHUAs) for bull (Carcharhinus leucas), great hammerhead (Sphyrna mokarran) and tiger sharks (Galeocerdo cuvier) in relation to specific MPAs and exclusive economic zones (EEZs) in the western North Atlantic Ocean.        MethodsBull, great hammerhead and tiger sharks (N=86 total) were satellite tagged and tracked in southern Florida and the northern Bahamas between 2010 and 2013. Filtered and regularized positions from Argos locations of tag transmissions were used to generate CHUAs for these sharks. Overlaps of CHUAs with regional protected areas and exclusive economic management zones were quantified to determine the proportion of each tracked shark's CHUA under spatial protection from exploitation.        ResultsA total of 0%, 17.9% and 34.7% of the regional CHUAs for tracked bull, great hammerhead and tiger sharks, respectively, were fully protected from exploitation in the study area.        Main conclusionsExpansion of protected areas to include U.S. territorial waters would effectively protect 100% of the CHUAs for all tracked sharks in the study area. This finding is particularly significant for great hammerhead sharks, which are currently overfished, vulnerable to bycatch mortality and are the focus of strident regional conservation efforts. These findings also provide a means to inform decision makers and marine conservation planning efforts as to the types of management actions available and potential efficacy of spatial protections for these marine predators.",2016-05-01,Bruna,Excluded,"MPA,Elasmo,__EXR__Elasmo",
