Rayyan Key,Authors,DOI,Title,Abstract,Date,User1,Decision,Labels,Notes
rayyan-231267364,"Sibley, ECP and Madgett, AS and Lawrence, JM and Elsdon, TS and Marnane, MJ and Fernandes, PG",10.1093/icesjms/fsad156,Quantifying the ability of imaging sonar to identify fish species at a subtropical artificial reef,"Imaging sonars (ISs) are high-frequency acoustic devices that are increasingly being used to study fish in marine and freshwater habitats. Acoustic devices are limited in quantifying species richness, and previous attempts to identify fish species using IS have mostly focused on assemblages of low species richness or high morphological diversity. This study aimed to determine the ability of IS for identifying fish species at a subtropical artificial reef off Perth, Western Australia. Several fish traits that could be defined using IS were identified and described for all fish species observed with simultaneous optical footage. These traits were used to create a clustering algorithm to infer the species identity of IS detections of the five most abundant species at the reef. The identities of all fish from two species (Chromis westaustralis and Neatypus obliquus) were inferred with 100% success, though no individuals from the remaining three species (Seriola dumerili, Coris auricularis, and Pempheris klunzingeri) were correctly identified. An alternative clustering-based approach to categorising fish detected by IS independent of taxonomic inference was also implemented. Overall, this study demonstrates that IS can identify reef fish with variable success, and proposes an alternative method for describing fish assemblages irrespective of species identity.",2023-10-26,Bruna,Excluded,"Not acoustic telemetry,__EXR__Not acoustic telemetry",
rayyan-231267372,"Ghazali, SM and Montgomery, JC and Jeffs, AG and Ibrahim, Z and Radford, CA",10.1016/j.fishres.2013.07.015     WE  - Science Citation Index Expanded (SCI-EXPANDED),The diel variation and spatial extent of the underwater sound around a fish aggregation device (FAD),"Fish aggregation devices (FADS) are widely used as tools for facilitating fisheries, however, many questions remain as to the manner in which they work. Sound has been long suggested as a potential attraction and orientation cue but this is yet to be demonstrated. Here the temporal and spatial characteristics of the underwater sound around an operating FAD were characterised to evaluate sound as a potential cue for fish attraction. The FAD was located in the coastal waters of northeast Malaysia where they are locally known as 'unjam'. The underwater signal of the FAD showed a distinct rise in sound energy between 500 and 2000 Hz across three octave bands. The spectral characteristics of this signal suggest that the source was animals inhabiting the FAD. The daily sound pattern showed that the signal was loudest during dusk, followed by night, dawn and significantly lowest during the day (14-20 dB lower than dusk). There was also a significant relationship between signal loss and distance away from the FAD, however, this did not follow conventional point source spreading models for underwater sound. In comparison to the estimated background noise of the prevailing sea state, the FAD signal was detectable up to 400 m away during the day and up to 1000 m during dusk. The bioacoustically rich unjam signal overlaps the frequency range of the hearing of many fishes, indicating that the acoustic signal emanating from FADs has the potential to attract fish and provide a long range orientation cue. (C) 2013 Elsevier B.V. All rights reserved.",2013-11-01,Bruna,Excluded,"Not acoustic telemetry,__EXR__Not acoustic telemetry",
rayyan-231267377,"Schärer, MT and Nemeth, MI and Mann, D and Locascio, J and Appeldoorn, RS and Rowell, TJ",10.1643/CE-10-151     WE  - Science Citation Index Expanded (SCI-EXPANDED),"Sound Production and Reproductive Behavior of Yellowfin Grouper, Mycteroperca venenosa (Serranidae) at a Spawning Aggregation","Reproductive behaviors and sound production of the Yellowfin grouper (Mycteroperca venenosa) are described from in-situ observations by divers as well as synchronous underwater audio-video recordings at a spawning aggregation off Mona Island, Puerto Rico. The highest abundances of M. venenosa estimated from underwater visual surveys were detected in March and April, five to nine days after the full moon (DAFM). Four distinct color phases were observed for M. venenosa; two of these were unique to the spawning aggregation and one, the white-headed phase, was exhibited during interactions with other conspecifics corresponding to courtship displays. Variations in color phases during fish Interactions and group formation coupled with sounds preceded spawning, which occurred near sunset. Low-frequency (<150 Hz) sounds produced by M. venenosa were variable yet they were classified into two types, pulsed and tonal. Both types of sounds were associated with reproductive behaviors although not linked to spawning rushes. These sounds were most frequent between 1800 and 2100 h, peaked the eighth DAFM, and ceased between 11-13 DAFM. Temporal patterns in sound production suggest that peak reproduction occurred in April followed by a smaller aggregation in May of 2010. The association of passive acoustics with reproductive behaviors for M. venenosa provides a tool to help identify spawning aggregation sites and monitor spawning stock abundance to evaluate the effectiveness of management and conservation efforts for this Near Threatened grouper.",2012-03-30,Bruna,Excluded,"Spawning,Bioacoustics,Not acoustic telemetry,__EXR__Not acoustic telemetry",
rayyan-231267386,"Appeldoorn-Sanders, E and Schärer-Umpierre, MT and Cruz-Motta, JJ",10.1016/j.ocecoaman.2022.106270,Passive acoustics as a tool to quantify/characterize vessel activity at fish spawning aggregation sites,"The vulnerability of fish spawning aggregations (FSA) to fishing pressure has led to seasonal fishing bans for certain aggregating reef-fish species and seasonal or permanent closures of known FSA sites throughout the Caribbean. While discerning the degree of compliance with fisheries regulations is essential in evaluating their success, this information can be scarce when opportunistic surveillance from enforcement vessels is minimal or absent. We used passive acoustic recorders to determine the temporal patterns of vessel activity at three red hind, Epinephelus guttatus, spawning aggregation sites off western Puerto Rico with varying levels of protection (Buoy 4: no regulation, Abrir la Sierra (ALS): seasonal closure, and Mona: permanent closure) during the closed (January and February) and open (March) periods for the capture of red hind. We proposed that dynamic vessel sounds (e.g., gear shifting, sudden changes in speed) at known FSA sites and during aggregating periods could be indicative of fishing activity. A band-limited energy detector was used to detect vessel sounds, with detections grouped into discreate vessel events and classified as having only constant vessel sounds or containing dynamic vessel sounds. While most of the vessel events consisted of constant vessel sounds at all sites, events with dynamic vessel sounds were greatest at Buoy 4, followed by ALS and only one detected at Mona. Average events with dynamic vessel sounds were greater during the closed than the open period at Buoy 4, while the opposite was found at ALS, and red hind calling activity was significantly correlated with vessel detections during 3 years at Buoy 4. Results suggest fishers may have been targeting red hind at Buoy 4 despite red hind's seasonal closure, and the site-specific regulations at ALS may have served as a deterrent and divert fishing effort towards other areas. Acoustic records can reveal high-resolution temporal patterns of vessel activity and of events with dynamic vessel sounds, which could be used to infer about fishing activities and complement other surveys to provide estimates of compliance.",2022-07-01,Bruna,Excluded,"Spawning,Bioacoustics,Not acoustic telemetry,__EXR__Not acoustic telemetry",
rayyan-231267394,"Salas, AK and Wilson, PS and Fuiman, LA",10.1242/jeb.201962     WE  - Science Citation Index Expanded (SCI-EXPANDED),Ontogenetic change in predicted acoustic pressure sensitivity in larval red drum (Sciaenops ocellatus),"Detecting acoustic pressure can improve a fish's survival and fitness through increased sensitivity to environmental sounds. Pressure detection results from interactions between the swim bladder and otoliths. In larval fishes, those interactions change rapidly as growth and development alter bladder dimensions and otolith-bladder distance. We used computed tomography imagery of lab-reared larval red drum (Sciaenops ocellatus) in a finite-element model to assess ontogenetic changes in acoustic pressure sensitivity in response to a plane wave at frequencies within the frequency range of hearing by fishes. We compared the acceleration at points on the sagitta, asteriscus and lapillus when the bladder was air filled with results from models using a water-filled bladder. For larvae of 8.5 - 18 mm in standard length, the air-filled bladder amplified simulated otolith motion by a factor of 54-3485 times that of a water-filled bladder at 100 Hz. Otolith-bladder distance increased with standard length, which decreased modeled amplification. The concomitant rapid increase in bladder volume partially compensated for the effect of increasing otolith-bladder distance. Calculated resonant frequency of the bladders was between 8750 and 4250 Hz, and resonant frequency decreased with increasing bladdervolume. There was a relatively flat frequency dependence of these effects in the audible frequency range, but we found a small increase in amplification with increasing excitation frequency. Using idealized geometry, we found that the larval vertebrae and ribs have negligible influence on bladder motion. Our results help clarify the auditory consequences of ontogenetic changes in bladder morphology and otolith-bladder relationships during larval stages.",2019-08-01,Bruna,Excluded,"Not acoustic telemetry,__EXR__Not acoustic telemetry",
rayyan-231267397,"Mann, DA and Casper, BM and Boyle, KS and Tricas, TC",10.3354/meps338307     WE  - Science Citation Index Expanded (SCI-EXPANDED),On the attraction of larval fishes to reef sounds,"Several recent studies have shown that some larval fishes will approach underwater speakers that broadcast reef noise, leading to the hypothesis that larval fishes use acoustic cues to locate reefs for settlement. The purpose of the present study was to examine existing hearing data of fishes in relation to ambient sound levels around reefs to estimate the distance over which reef fish might detect reefs sounds, and to highlight how future data should be collected to answer this important question. The few available measurements of larval fish hearing indicate that they have poor acoustic sensitivity relative to sound levels found around reefs. The apparent poor sensitivity of larval fishes to sound pressure suggests that particle motion, the back and forth motion of water that is associated with acoustic pressure, is the principal stimulus for larval fish hearing. To estimate the maximum distance of orientation to reefs, the acoustic particle velocity of reef sound was calculated from measurements of the acoustic pressure on and away from shore, assuming conditions of a planar propagating wave. Based on these calculations, we propose that larval fishes in acoustically unbounded habitats most probably cannot detect the ambient noise of particle motion at distances >1 km. To better understand the distances over which larval fishes can detect sounds from reefs, more studies on larval fish hearing and reef noise are needed. Larval fish hearing measurements need to independently distinguish sensitivities to particle motion and acoustic pressure. Likewise, independent measurements of particle motion around reefs are required.",2007-01-01,Bruna,Excluded,"Bioacoustics,Not acoustic telemetry,__EXR__Not acoustic telemetry",
rayyan-231267400,"Stanley, JA and Hesse, J and Hinojosa, IA and Jeffs, AG",10.1007/s00442-015-3251-4     WE  - Science Citation Index Expanded (SCI-EXPANDED),Inducers of settlement and moulting in post-larval spiny lobster,"The rapid and often remote location of suitable habitats used by migrating organisms is often critical to their subsequent recruitment, fitness and survival, and this includes in the marine environment. However, for the non-feeding post-larval stage of spiny lobsters, effective settlement cues for habitat selection are critical to their success but are poorly described. Therefore, the current study examined whether acoustic and substrate cues have the potential to shorten the time to moulting and affect their subsequent nutritional condition in the pueruli of the southern spiny lobster, Jasus edwardsii. Individuals moulted to first instar juveniles up to 38 % faster when exposed to the underwater sound from two types of typical settlement habitat (coastal kelp- and urchin-dominated reefs) compared to those with no underwater sound. The settlement delay in the post-larvae without underwater sound also resulted in juveniles in poorer survival and nutritional condition as measured by their protein and lipid contents. In a separate experiment, post-larvae presented with seaweed and rock substrates were found to complete settlement and moult to juvenile by as much as 20 % faster compared to those on the sand and control treatments. Overall, the results are the first to demonstrate that the pueruli of J. edwardsii have the ability to detect and respond to underwater sound, as well as determining that both acoustic and substrate cues play a role in modulating physiological development during settlement.",2015-07-01,Bruna,Excluded,"Non-fish species,Not acoustic telemetry,__EXR__Non-fish species,__EXR__Not acoustic telemetry",
rayyan-231267438,"Manik, HM",10.1155/2016/2350615     WE  - Emerging Sources Citation Index (ESCI),Acoustical Measurement and Biot Model for Coral Reef Detection and Quantification,"Coral reefs are coastal resources and very useful for marine ecosystems. Nowadays, the existence of coral reefs is seriously threatened due to the activities of blast fishing, coral mining, marine sedimentation, pollution, and global climate change. To determine the existence of coral reefs, it is necessary to study them comprehensively. One method to study a coral reef by using a propagation of sound waves is proposed. In this research, the measurement of reflection coefficient, transmission coefficient, acoustic backscattering, hardness, and roughness of coral reefs has been conducted using acoustic instruments and numerical modeling using Biot theory. The results showed that the quantification of the acoustic backscatter can classify the type of coral reef.",2016-01-01,Bruna,Excluded,"Bioacoustics,Not acoustic telemetry,__EXR__Not acoustic telemetry",
rayyan-231267439,"Bierwagen, SL and Heupel, MR and Chin, A and Simpfendorfer, CA",10.3389/fmars.2018.00024     WE  - Science Citation Index Expanded (SCI-EXPANDED),Trophodynamics as a Tool for Understanding Coral Reef Ecosystems,"The increased frequency of publications concerning trophic ecology of coral reefs suggests a degree of interest in the role species and functional groups play in energy flow within these systems. Coral reef ecosystems are particularly complex, however, and assignment of trophic positions requires precise knowledge of mechanisms driving food webs and population dynamics. Competent analytical tools and empirical analysis are integral to defining ecosystem processes and avoiding misinterpretation of results. Here we examine the contribution of trophodynamics to informing ecological roles and understanding of coral reef ecology. Applied trophic studies of coral reefs were used to identify recent trends in methodology and analysis. Although research is increasing, clear definitions and scaling of studies is lacking. Trophodynamic studies will requiremore precise spatial and temporal data collection and analysis using multiple methods to fully explore the complex interactions within coral reef ecosystems.",2018-02-06,Bruna,Excluded,"Review article,__EXR__Review article,Not acoustic telemetry,__EXR__Not acoustic telemetry",
rayyan-231267442,"Dinh, JP and Suca, JJ and Lillis, A and Apprill, A and Llopiz, JK and Mooney, TA",10.1016/j.marpolbul.2018.09.009     WE  - Science Citation Index Expanded (SCI-EXPANDED),Multiscale spatio-temporal patterns of boat noise on US Virgin Island coral reefs,"Sound-sensitive organisms are abundant on coral reefs. Accordingly, experiments suggest that boat noise could elicit adverse effects on coral reef organisms. Yet, there are few data quantifying boat noise prevalence on coral reefs. We use long-term passive acoustic recordings at nine coral reefs and one sandy comparison site in a marine protected area to quantify spatio-temporal variation in boat noise and its effect on the soundscape. Boat noise was most common at reefs with high coral cover and fish density, and temporal patterns reflected patterns of human activity. Boat noise significantly increased low-frequency sound levels at the monitored sites. With boat noise present, the peak frequencies of the natural soundscape shifted from higher frequencies to the lower frequencies frequently used in fish communication. Taken together, the spectral overlap between boat noise and fish communication and the elevated boat detections on reefs with biological densities raises concern for coral reef organisms.",2018-11-01,Bruna,Excluded,"Not acoustic telemetry,__EXR__Not acoustic telemetry",
rayyan-231267443,"Ferrier-Pages, C and Leal, MC and Calado, R and Schmid, DW and Bertucci, F and Lecchini, D and Allemand, D",10.1016/j.marpolbul.2021.112129,Noise pollution on coral reefs? - A yet underestimated threat to coral reef communities,"Noise pollution is an anthropogenic stressor that is increasingly recognized for its negative impact on the physiology, behavior and fitness of marine organisms. Driven by the recent expansion of maritime shipping, artisanal fishing and tourism (e.g., motorboats used for recreational purpose), underwater noise increased greatly on coral reefs. In this review, we first provide an overview on how reef organisms sense and use sound. Thereafter we review the current knowledge on how underwater noise affects different reef organisms. Although the majority of available examples are limited to few fish species, we emphasize how the impact of noise differs based on an organisms' acoustic sensitivity, mobility and developmental stage, as well as between noise type, source and duration. Finally, we highlight measures available to governments, the shipping industry and individual users and provide directions for polices and research aimed to manage this global issue of noise emission on coral reefs.",2021-04-01,Bruna,Excluded,"Bioacoustics,Not acoustic telemetry,__EXR__Not acoustic telemetry",
rayyan-231267444,"Moyer, RP and Riegl, B and Banks, K and Dodge, RE",,"Assessing the accuracy of acoustic seabed classification for mapping coral reef environments in South Florida (Broward County, USA)","The Atlantic coast of Broward County, Florida (USA) is paralleled by a series of progressively deeper, shore-parallel coral reef communities. Two of these reef systems are drowned early Holocene coral reefs of 5 ky and 7 ky uncorrected radiocarbon age. Despite the ease of access to these reefs, and their major contribution to the local economy, accurate benthic habitat maps of the area are not available. Ecological studies have shown that different benthic communities (i.e. communities composed of different biological taxa) exist along several spatial gradients on all reefs. Since these studies are limited by time and spatial extent, acoustic surveys with the QTCView V bottom classification system based on a 50 kHz transducer were used as an alternative method of producing habitat maps. From the acoustic data of a 3.1 km(2) survey area, spatial prediction maps were created for the area. These were compared with habitat maps interpreted from in situ data and Laser Airborne Depth Sounder (LADS) bathymetry, in order to ground-truth the remotely sensed data. An error matrix was used to quantitatively determine the accuracy of the acoustically derived spatial prediction model against the maps derived from the in situ and LADS data sets. Confusion analysis of 100 random points showed that the system was able to distinguish areas of reef from areas of rubble and sand with an overall accuracy of 61%. When asked to detect more subtle spatial differences, for example, those between distinct reef communities, the classification was only about 40% accurate. We discuss to what degree a synthesis of acoustic and in situ techniques can provide accurate habitat maps in coral reef environments, and conclude that acoustic methods were able to reflect the spatial extent and composition of at least three different biological communities.",2005-05-01,Bruna,Excluded,"Not acoustic telemetry,__EXR__Not acoustic telemetry",
rayyan-231267445,"Lammers, MO and Brainard, RE and Au, WWL and Mooney, TA and Wong, KB",10.1121/1.2836780     WE  - Science Citation Index Expanded (SCI-EXPANDED),An ecological acoustic recorder (EAR) for long-term monitoring of biological and anthropogenic sounds on coral reefs and other marine habitats,"Keeping track of long-term biological trends in many marine habitats is a challening task that is exacerbated when the habitats in question are in remote locations. Monitoring the ambient sound field may be a useful way of assessing biological activity because many behavioral processes are accompanied by sound production. This article reports the preliminary results of an effort to develop and use an Ecological Acoustic Recorder (EAR) to monitor biological activity on coral reefs and in surrounding waters for periods of I year or longer. The EAR is a microprocessor-based autonomous recorder that periodically samples the ambient sound field and also automatically detects sounds that meet specific criteria. The system was used to record the sound field of coral reefs and other marine habitats on Oahu, HI. Snapping shrimp produced the dominant acoustic energy on the reefs examined and exhibited clear diel acoustic trends. Other biological sounds recorded included those produced by fish and cetaceans, which also exhibited distinct temporal variability. Motor vessel activity could also be monitored effectively with the EAR. The results indicate that acoustic monitoring may be an effective means of tracking biological and anthropogenic activity at locations where continuous monitoring by traditional survey methods is impractical. (C) 2008 Acoustical Society of America.",2008-03-01,Bruna,Excluded,"Bioacoustics,Not acoustic telemetry,__EXR__Not acoustic telemetry",
rayyan-231267446,"Morrison, MA and Jeffs, AG and Hooker, SH",10.1080/01431160903376381     WE  - Science Citation Index Expanded (SCI-EXPANDED),Detection of sub-tidal mussel beds on rocky reefs using acoustics,"The collection of recently settled wild mussels from beach-cast seaweed provides the seed for a large and rapidly expanding mussel aquaculture industry in New Zealand, but the locations of adult populations producing this seed are unknown. Traditional methods of assessing sub-tidal habitats of rocky reefs (diver census, video camera drops) are neither cost-effective nor practical for the relatively large spatial scales involved. Remote sensing tools offer solutions to this problem. We tested the ability of the acoustic seafloor classification system, Quester Tangent Corporation (QTC) Impact, to detect the presence of green-lipped mussel (Perna canaliculus) populations on sub-tidal rocky reefs. Acoustic data were collected from a range of visual subtidal habitats, combined, and analysed using QTC Impact's principal component analysis and clustering software. Discriminant function analysis assessed whether visually distinctive habitats could be correctly classified using this acoustic data only. Consistent and reliable classifications were found for continuous mussel beds (100% correct, 0% misclassification from other habitat types), and sand, while the other various classes of rocky reef habitats (i.e. reef with varying levels of biological cover of kelps and encrusting invertebrates, including occasional mussel patches at one site) were identifiable to a general class of rocky reef, without significant mussel cover. These results demonstrate that QTC Impact can reliably discriminate subtidal mussel beds on rocky reefs from other habitats, making it feasible to proceed with large-scale mapping.",2010-01-01,Bruna,Excluded,"Not acoustic telemetry,__EXR__Not acoustic telemetry",
