Rayyan Key,Authors,DOI,Title,Abstract,Date,User1,Decision,Labels,Notes
rayyan-228915352,"Chin, A and Heupel, MR and Simpfendorfer, CA and Tobin, AJ",10.3354/meps11545     WE  - Science Citation Index Expanded (SCI-EXPANDED),Population organisation in reef sharks: new variations in coastal habitat use by mobile marine predators,"Coastal habitats provide important functions for many species and may serve as nursery grounds for teleost fishes and sharks and rays. However, the importance of these habitats in sustaining marine species at seascape scales is debated, and their significance to reef shark populations is poorly understood. The blacktip reef shark Carcharhinus melanopterus is a widely distributed mobile marine predator; we explored its use of shallow, turbid coastal habitats in the Great Barrier Reef using tagging and acoustic telemetry. Residency and movement patterns of 23 individuals were monitored for up to 28 mo, revealing different patterns between sexes and sizes. Neonate/juveniles were short-term residents; adult females were long-term residents and preliminary data suggest that adult males were vagrants. Adult females and neonate/juveniles had small activity spaces (50% kernel utilisation distribution, KUD < 5 km(2)) and shared the same habitats and locations while adult males (when present) had larger activity spaces (50% KUD up to 14 km(2)). Population organisation, movement patterns and biological data suggest that blacktip reef sharks may use turbid coastal habitats for reproduction. This study reveals a new variation in coastal habitat use by sharks with habitat use patterns differing from those observed in other coastal sharks, and from conspecifics on coral reefs. These patterns do not conform to the characteristics of classical shark nurseries, and highlight the species' ecological flexibility. The study also demonstrates that shark behaviour and habitat use patterns can affect their vulnerability to fishing, habitat loss and climate change, and can affect the efficacy of marine protected areas.",2016-02-18,Bruna,Excluded,"Elasmo,__EXR__Elasmo",
rayyan-228915353,"Espinoza, M and Heupel, MR and Tobin, AJ and Simpfendorfer, CA",10.1371/journal.pone.0147608     WE  - Science Citation Index Expanded (SCI-EXPANDED),Evidence of Partial Migration in a Large Coastal Predator: Opportunistic Foraging and Reproduction as Key Drivers?,"Understanding animal movement decisions that involve migration is critical for evaluating population connectivity, and thus persistence. Recent work on sharks has shown that often only a portion of the adult population will undertake migrations, while the rest may be resident in an area for long periods. Defining the extent to which adult sharks use specific habitats and their migratory behaviour is essential for assessing their risk of exposure to threats such as fishing and habitat degradation. The present study used acoustic telemetry to examine residency patterns and migratory behaviour of adult bull sharks (Carcharhinus leucas) along the East coast of Australia. Fifty-six VR2W acoustic receivers were used to monitor the movements of 33 bull sharks in the central Great Barrier Reef (GBR). Both males and females were detected year-round, but their abundance and residency peaked between September and December across years (2012-2014). High individual variability in reef use patterns was apparent, with some individuals leaving the array for long periods, whereas others (36%) exhibited medium (0.20-0.40) or high residency (>0.50). A large portion of the population (51%) undertook migrations of up to 1,400 km to other coral reefs and/or inshore coastal habitats in Queensland and New South Wales. Most of these individuals (76%) were mature females, and the timing of migrations coincided with the austral summer (Dec-Feb). All migrating individuals (except one) returned to the central GBR, highlighting its importance as a potential foraging ground. Our findings suggest that adult bull sharks appear to be highly dependent on coral reef resources and provide evidence of partial migration, where only a portion of the female population undertook seasonal migrations potentially to give birth. Given that estuarine habitats face constant anthropogenic pressures, understanding partial migration and habitat connectivity of large coastal predators should be a priority for their management.",2016-02-03,Bruna,Excluded,"Elasmo,__EXR__Elasmo",
rayyan-228915354,"Iafrate, JD and Watwood, SL and Reyier, EA and Gilchrest, M and Crocker, SE",10.1007/978-1-4939-2981-8_58     WE  - Conference Proceedings Citation Index - Science (CPCI-S)     WE  - Science Citation Index Expanded (SCI-EXPANDED),Residency of Reef Fish During Pile Driving Within a Shallow Pierside Environment,"The potential effects of pile driving on fish populations and commercial fisheries have received significant attention given the prevalence of construction occurring in coastal habitats throughout the world. In this study, we used acoustic telemetry to assess the movement and survival of free-ranging reef fish in Port Canaveral, FL, in response to 35 days of pile driving at an existing wharf complex. The site fidelity and behavior of 15 sheepshead (Archosargus probatocephalus) and 10 gray snapper (Lutjanus griseus) were determined before, during, and after pile driving. No obvious signs of mortality or injury to tagged fish were evident from the data. There was a significant decline in the residency index for mangrove snapper at the construction wharf after pile driving compared with the baseline, although this may be influenced by natural movements of this species in the study area rather than a direct response to pile driving.",2016-01-01,Bruna,Included,,
rayyan-228915355,"Abecasis, D and Afonso, P and Erzini, K",10.1016/j.ecss.2015.10.032     WE  - Science Citation Index Expanded (SCI-EXPANDED),Changes in movements of white seabream (Diplodus sargus) during the reproductive season,"It has been hypothesized, based on anecdotal information and reports, that adult white seabream migrate and aggregate during spawning. Because most of the past telemetric studies on this ecologically and commercially important species were short in duration and did not cover the reproductive season, we set out to use longer-term passive acoustic telemetry to test this hypothesis. We found that white seabream expands its home range and increases the frequency of forays during the reproductive season, but found no obvious signs of spawning aggregations. Our results thus provide evidence for short-range behavioral shifts in fish space use related to reproductive activity, and support the notion that small MPAs may be effective in managing reef fish populations by effectively protecting their spawning biomass. (c) 2015 Elsevier Ltd. All rights reserved.",2015-12-20,Bruna,Included,,
rayyan-228915356,"Espinoza, M and Lédée, EJI and Simpfendorfer, CA and Tobin, AJ and Heupel, MR",,Contrasting movements and connectivity of reef-associated sharks using acoustic telemetry: implications for management,"Understanding the efficacy of marine protected areas (MPAs) for wide-ranging predators is essential to designing effective management and conservation approaches. The use of acoustic monitoring and network analysis can improve our understanding of the spatial ecology and functional connectivity of reef-associated species, providing a useful approach for reef-based conservation planning. This study compared and contrasted the movement and connectivity of sharks with different degrees of reef association. We examined the residency, dispersal, degree of reef connectivity, and MPA use of grey reef (Carcharhinus amblyrhynchos), silvertip (C. albimarginatus), and bull (C. leucas) sharks monitored in the central Great Barrier Reef (GBR). An array of 56 acoustic receivers was used to monitor shark movements on 17 semi-isolated reefs. Carcharhinus amblyrhynchos and C. albimarginatus were detected most days at or near their tagging reef. However, while C. amblyrhynchos spent 80% of monitoring days in the array, C. albimarginatus was only detected 50% of the time. Despite both species moving similar distances (<50 km), a large portion of the population of C. albimarginatus (71%) was detected on multiple reefs and moved more frequently between reefs and management zones than C. amblyrhynchos. Carcharhinus leucas was detected less than 20% of the time within the tagging array, and 42% of the population undertook long-range migrations to other arrays in the GBR. Networks derived for C. leucas were larger and more complex than those for C. amblyrhynchos and C. albimarginatus. Our findings suggest that protecting specific reefs based on prior knowledge (e.g., healthier reefs with high fish biomass) and increasing the level of protection to include nearby, closely spaced reef habitats (<20 km) may perform better for species like C. albimarginatus than having either a single or a network of isolated MPAs. This design would also provide protection for larger male C. amblyrhynchos, which tend to disperse more and use larger areas than females. For wide-ranging sharks like C. leucas, a combination of spatial planning and other alternative measures is critical. Our findings demonstrate that acoustic monitoring can serve as a useful platform for designing more effective MPA networks for reef predators displaying a range of movement patterns.",2015-12-01,Bruna,Excluded,"MPA,Elasmo,__EXR__Elasmo",
rayyan-228915357,"Currey, LM and Heupel, MR and Simpfendorfer, CA and Williams, AJ",10.1007/s00338-015-1318-7     WE  - Science Citation Index Expanded (SCI-EXPANDED),Assessing environmental correlates of fish movement on a coral reef,"Variation in dispersal and movement patterns of coral reef fishes is likely linked to changes in environmental conditions. Monitoring in situ environmental parameters on coral reefs in conjunction with the movements of fishes can help explain the relationship between exploited populations and their environment. Sixty adult Lethrinus miniatus were acoustically tagged and monitored along a coral reef slope for up to 1 yr. Individuals occurred more often on the reef slope during days of cooler temperatures, suggesting a thermal tolerance threshold may exist. Results indicate that individuals responded to elevated temperatures by moving away from the reef slope to deeper adjacent habitats, thus shifting their position in the water column to remain at a preferred temperature. Space use within the water column (vertical activity space) was not influenced by environmental parameters or fish size, but this result was possibly influenced by use of deeper habitat outside the acoustic array that was not monitored. With elevation of ocean temperature, L. miniatus may need to adapt to warmer waters or disperse into cooler habitats, by either shifting their distribution deeper or towards higher latitudes. Identifying key environmental drivers that affect the distribution of reef fishes is important, and may allow managers to predict the effect of these changes on exploited species.",2015-12-01,Bruna,Included,,
rayyan-228915358,"Williams, LJ and Herbig, JL and Szedlmayer, ST",10.1016/j.fishres.2015.06.030     WE  - Science Citation Index Expanded (SCI-EXPANDED),A cage release method to improve fish tagging studies,"The return and survival of tagged fish to their depth of capture has proved difficult due to barotrauma and predation in previous telemetry studies. Tagging stress can slow and disorient the fish upon release, and reduce the ability to return to depth, relocate their home habitat site, and evade predators. To reduce these initial tag and release artifacts we designed and tested a remotely opening cage for use with reef fish in the northern Gulf of Mexico. Our objectives were to quickly return transmitter tagged fish to depth (20-30 m) in close proximity (<10 m) to their capture site, and to increase survival by providing predator protection during an initial recovery period. This cage release method proved successful for both red snapper (Lutjanus campechanus; n=62 out of 71, 87%) and all gray triggerfish (Batistes capriscus; n=24) that were tagged and released on artificial reefs. All tagged fish were released from November 2012 to September 2014, no initial tag induced mortalities were observed, and after tagging fish were successfully tracked for extended periods (for the entire 2 year study period). (C) 2015 Elsevier B.V. All rights reserved.",2015-12-01,Bruna,Excluded,"Methodological article,__EXR__Methodological article",
rayyan-228915359,"Harasti, D and Lee, KA and Gallen, C and Hughes, JM and Stewart, J",10.1371/journal.pone.0142454     WE  - Science Citation Index Expanded (SCI-EXPANDED),"Movements, Home Range and Site Fidelity of Snapper (Chrysophrys auratus) within a Temperate Marine Protected Area","Understanding the movement dynamics of marine fish provides valuable information that can assist with species management, particularly regarding protection within marine protected areas (MPAs). We performed an acoustic tagging study implemented within the Port Stephens-Great Lakes Marine Park on the mid-north coast of New South Wales, Australia, to assess the movement patterns, home range and diel activity of snapper (Chrysophrys auratus; Sparidae); a species of significant recreational and commercial fishing importance in Australia. The study focused on C. auratus movements around Cabbage Tree Island, which is predominantly a no-take sanctuary zone (no fishing), with an array of acoustic stations deployed around the island and adjacent reefs and islands. Thirty C. auratus were tagged with internal acoustic tags in November 2010 with their movements recorded until September 2014. Both adult and juvenile C. auratus were observed to display strong site fidelity to Cabbage Tree Island with a mean 12-month residency index of 0.83 (range = 0 low to 1 high). Only three fish were detected on acoustic receivers away from Cabbage Tree Island, with one fish moving a considerable distance of similar to 290 kms over a short time frame (46 days). The longest period of residency recorded at the island was for three fish occurring regularly at the site for a period of 1249 days. Chrysophrys auratus displayed strong diurnal behaviour and detection frequency was significantly higher during the day than at night; however, there was no significant difference in detection frequency between different hours. This study demonstrates that even small-scale protected areas can benefit C. auratus during multiple life-history stages as it maintains a small home range and displays strong site fidelity over a period of 3 years.",2015-11-06,Bruna,Included,MPA,
rayyan-228915360,"Gardiner, JM and Whitney, NM and Hueter, RE",10.1093/icb/icv087     WE  - Science Citation Index Expanded (SCI-EXPANDED),"Smells Like Home: The Role of Olfactory Cues in the Homing Behavior of Blacktip Sharks, Carcharhinus limbatus","Synopsis Animal navigation in the marine environment is believed to be guided by different sensory cues over different spatial scales. Geomagnetic cues are thought to guide long-range navigation, while visual or olfactory cues allow animals to pinpoint precise locations, but the complete behavioral sequence is not yet understood. Terra Ceia Bay is a primary nursery area for blacktip sharks, Carcharhinus limbatus, on southwestern Florida's Gulf of Mexico coast. Young-of-theyear animals show strong fidelity to a specific home range in the northeastern end of the bay and rapidly return when displaced. Older juveniles demonstrate annual philopatry for the first few years, migrating as far south as the Florida Keys each fall, then returning to Terra Ceia Bay each spring. To examine the sensory cues used in homing, we captured neonate (53 weeks old) blacktip sharks from within their home range, fitted them with acoustic tags, and translocated them to sites 8km away in adjacent Tampa Bay and released them. Intact animals returned to their home range, within 34 h on average, and remained there. With olfaction blocked, fewer animals returned to their home range and they took longer to do so, 130 h on average. However, they did not remain there but instead moved throughout Terra Ceia Bay and in and out of Tampa Bay. Since sharks from both treatments returned at night in tannic and turbid water, vision is likely not playing a major role in navigation by these animals. The animals in this study also returned on incoming or slack tides, suggesting that sharks, like many other fish, may use selective tidal stream transport to conserve energy and aid navigation during migration. Collectively, these results suggest that while other cues, possibly geomagnetic and/or tidal information, might guide sharks over long distances, olfactory cues are required for recognizing their specific home range.",2015-09-01,Bruna,Excluded,"Elasmo,__EXR__Elasmo",
rayyan-228915361,"Espinoza, M and Heupel, MR and Tobin, AJ and Simpfendorfer, CA",10.1007/s00338-015-1312-0     WE  - Science Citation Index Expanded (SCI-EXPANDED),Movement patterns of silvertip sharks (Carcharhinus albimarginatus) on coral reefs,"Understanding how sharks use coral reefs is essential for assessing risk of exposure to fisheries, habitat loss, and climate change. Despite a wide Indo-Pacific distribution, little is known about the spatial ecology of silvertip sharks (Carcharhinus albimarginatus), compromising the ability to effectively manage their populations. We examined the residency and movements of silvertip sharks in the central Great Barrier Reef (GBR). An array of 56 VR2W acoustic receivers was used to monitor shark movements on 17 semi-isolated reefs. Twenty-seven individuals tagged with acoustic transmitters were monitored from 70 to 731 d. Residency index to the study site ranged from 0.05 to 0.97, with a mean residency (+/- SD) of 0.57 +/- 0.26, but most individuals were detected at or near their tagging reef. Clear seasonal patterns were apparent, with fewer individuals detected between September and February. A large proportion of the tagged population (> 71 %) moved regularly between reefs. Silvertip sharks were detected less during daytime and exhibited a strong diel pattern in depth use, which may be a strategy for optimizing energetic budgets and foraging opportunities. This study provides the first detailed examination of the spatial ecology and behavior of silvertip sharks on coral reefs. Silvertip sharks remained resident at coral reef habitats over long periods, but our results also suggest this species may have more complex movement patterns and use larger areas of the GBR than common reef shark species. Our findings highlight the need to further understand the movement ecology of silvertip sharks at different spatial and temporal scales, which is critical for developing effective management approaches.",2015-09-01,Bruna,Excluded,"Elasmo,__EXR__Elasmo",
rayyan-228915362,"Zhang, YQ and Xu, Q and Alós, J and Liu, H and Xu, QZ and Yang, HS",10.1371/journal.pone.0134381     WE  - Science Citation Index Expanded (SCI-EXPANDED),"Short-Term Fidelity, Habitat Use and Vertical Movement Behavior of the Black Rockfish Sebastes schlegelii as Determined by Acoustic Telemetry","The recent miniaturization of acoustic tracking devices has allowed fishery managers and scientists to collect spatial and temporal data for sustainable fishery management. The spatial and temporal dimensions of fish behavior (movement and/or vertical migrations) are particularly relevant for rockfishes (Sebastes spp.) because most rockfish species are long-lived and have high site fidelity, increasing their vulnerability to overexploitation. In this study, we describe the short-term (with a tracking period of up to 46 d) spatial behavior, as determined by acoustic tracking, of the black rockfish Sebastes schlegelii, a species subject to overexploitation in the Yellow Sea of China. The average residence index (the ratio of detected days to the total period from release to the last detection) in the study area was 0.92 +/- 0.13, and most of the tagged fish were detected by only one region of the acoustic receiver array, suggesting relatively high site fidelity to the study area. Acoustic tracking also suggested that this species is more frequently detected during the day than at night in our study area. However, the diel detection periodicity (24 h) was only evident for certain periods of the tracking time, as revealed by a continuous wavelet transform. The habitat selection index of tagged S. schlegelii suggested that S. schlegelii preferred natural reefs, mixed sand/artificial reef bottoms and mixed bottoms of boulder, cobble, gravel and artificial reefs. The preference of this species for the artificial reefs that were recently deployed in the study area suggests that artificial seascapes may be effective management tools to attract individuals. The vertical movement of tagged S. schlegelii was mostly characterized by bottom dwelling behavior, and there was high individual variability in the vertical migration pattern. Our results have important implications for S. schlegelii catchability, the implementation of marine protected areas, and the identification of key species habitats, and our study provides novel information for future studies on the sustainability of this important marine resource in eastern China.",2015-08-31,Bruna,Included,,
rayyan-228915363,"Garcia, J and Mourier, J and Lenfant, P",10.1016/j.marenvres.2015.06.004     WE  - Science Citation Index Expanded (SCI-EXPANDED),Spatial behavior of two coral reef fishes within a Caribbean marine protected area,"A better understanding of the key ecological processes of marine organisms is fundamental to improving design and effective implementation of marine protected areas (MPAs) and marine biodiversity. The movement behavior of coral reef fish is a complex mechanism that is highly linked to species life-history traits, predation risk and food resources. We used passive acoustic telemetry to study monthly, daily and hourly movement patterns and space use in two species, Schoolmaster snapper (Lutjanus apodus) and Stoplight parrotfish (Sparisoma viride). We investigated the spatial overlap between the two species and compared intra-specific spatial overlap between day and night. Presence-absence models showed different diel presence and habitat use patterns between the two species. We constructed a spatial network of the movement patterns, which showed that for both species when fish were detected by the array of receivers most movements were made around the coral reef habitat while occasionally moving to silt habitats. Our results show that most individuals made predictable daily crepuscular migrations between different locations and habitat types, although individual behavioral changes were observed for some individuals across time. Our study also highlights the necessity to consider multiple species during MPA implementation and to take into account the specific biological and ecological traits of each species. The low number of fish detected within the receiver array, as well as the intraspecific variability observed in this study, highlight the need to compare results across species and individuals to be used for MPA management. (C) 2015 Elsevier Ltd. All rights reserved.",2015-08-01,Bruna,Included,,
rayyan-228915364,"Heupel, MR and Simpfendorfer, CA",10.1007/s00338-015-1272-4     WE  - Science Citation Index Expanded (SCI-EXPANDED),Long-term movement patterns of a coral reef predator,"Long-term monitoring is required to fully define periodicity and patterns in animal movement. This is particularly relevant for defining what factors are driving the presence, location, and movements of individuals. The long-term movement and space use patterns of grey reef sharks, Carcharhinus amblyrhynchos, were examined on a whole of reef scale in the southern Great Barrier Reef to define whether movement and activity space varied through time. Twenty-nine C. amblyrhynchos were tracked for over 2 years to define movement patterns. All individuals showed high residency within the study site, but also had high roaming indices. This indicated that individuals remained in the region and used all of the monitored habitat (i.e., the entire reef perimeter). Use of space was consistent through time with high reuse of areas most of the year. Therefore, individuals maintained discrete home ranges, but undertook broader movements around the reef at times. Mature males showed greatest variation in movement with larger activity spaces and movement into new regions during the mating season (August-September). Depth use patterns also differed, suggesting behaviour or resource requirements varied between sexes. Examination of the long-term, reef-scale movements of C. amblyrhynchos has revealed that reproductive activity may play a key role in space use and activity patterns. It was unclear whether mating behaviour or an increased need for food to sustain reproductive activity and development played a greater role in these patterns. Reef shark movement patterns are becoming more clearly defined, but research is still required to fully understand the biological drivers for the observed patterns.",2015-06-01,Bruna,Excluded,"Elasmo,__EXR__Elasmo",
